ZOHO_PRODUCT,COMPETITORS,TAG_LINE
CRM,"Salesforce CRM, HubSpot CRM, Dynamics 365",Customer Management
Campaigns,"Mailchimp, Constant Contact, SendinBlue",Email Marketing
Sign,"DocuSign, Adobe Sign, HelloSign",Digital Signing
Social,"Hootsuite, Buffer, Sprout Social",Social Management
SalesIQ,"LiveChat, Intercom, Drift",Live Chat
Backstage,"Eventbrite, Cvent, Bizzabo",Event Management
Survey,"SurveyMonkey, Typeform, Google Forms",Online Surveys
Commerce,"Shopify, WooCommerce, BigCommerce",Online Store
Forms,"Google Forms, JotForm, Typeform",Form Builder
Desk,"Zendesk, Freshdesk, Help Scout",Customer Support
Assist,"TeamViewer, AnyDesk, LogMeIn",Remote Support
Mail,"Gmail, Microsoft Outlook, ProtonMail",Business Email
Cliq,"Microsoft Teams, Slack, Google Chat",Team Chat
Meeting,"Zoom, Microsoft Teams, Webex",Video Conferencing
WorkDrive,"Google Drive, Dropbox, Microsoft OneDrive",Cloud Storage
Projects,"Asana, Trello, Microsoft Project",Project Management
Calendar,"Google Calendar, Outlook Calendar, Apple Calendar",Schedule Planning
Sheet,"Microsoft Excel, Google Sheets, Apple Numbers",Spreadsheet Tool
Recruit,"LinkedIn Talent Hub, Greenhouse, Workday",Hiring Platform
People,"BambooHR, Gusto, ADP Workforce Now",HR Management
Books,"QuickBooks, Xero, FreshBooks",Accounting Software
Inventory,"TradeGecko, Cin7, Unleashed",Stock Management
Checkout,"Stripe, Square, PayPal",Payment Processing
Expense,"Expensify, Concur, Rydoo",Expense Tracking
Invoice,"FreshBooks, QuickBooks, Wave",Billing Software
Subscriptions,"Chargebee, Recurly, Stripe Billing",Recurring Billing
Vault,"LastPass, 1Password, Dashlane",Password Manager
Creator,"Microsoft PowerApps, OutSystems, Mendix",App Builder
Flow,"Zapier, Integromat, Power Automate",Workflow Automation
Apptics,"Firebase Analytics, Mixpanel, Flurry Analytics",App Analytics
Analytics,"Tableau, Power BI, Qlik Sense",Data Analytics
Payroll,"Gusto, ADP, Paychex",Salary Processing
Directory,"Okta, Microsoft Azure AD, OneLogin",Identity Management
